{
  "$schema": "https://json-schema.org/draft/2020-12/schema",
  "title": "POST /decision",
  "type": "object",
  "properties": {
    "overall": {
      "type": "object",
      "properties": {
        "outcome": {
          "type": "string"
        },
        "best": {
          "type": "string"
        },
        "contenders": {
          "type": "array"
        },
        "reasons": {
          "type": "array",
          "items": {
            "type": "string"
          }
        },
        "next_actions": {
          "type": "array",
          "items": {
            "type": "object",
            "properties": {
              "code": {
                "type": "string"
              },
              "action": {
                "type": "string"
              },
              "owner_hint": {
                "type": "string"
              },
              "expected_test": {
                "type": "string"
              }
            },
            "required": [
              "action",
              "code",
              "expected_test",
              "owner_hint"
            ]
          }
        }
      },
      "required": [
        "best",
        "contenders",
        "next_actions",
        "outcome",
        "reasons"
      ]
    },
    "ranking": {
      "type": "array",
      "items": {
        "type": "object",
        "properties": {
          "contributions": {
            "type": "object",
            "properties": {
              "cash_share": {
                "type": "number"
              },
              "evidence": {
                "type": "number"
              },
              "net_annual": {
                "type": "number"
              },
              "npv": {
                "type": "number"
              },
              "payback": {
                "type": "number"
              },
              "readiness": {
                "type": "number"
              }
            },
            "required": [
              "cash_share",
              "evidence",
              "net_annual",
              "npv",
              "payback",
              "readiness"
            ]
          },
          "criteria": {
            "type": "object",
            "properties": {
              "cash_share": {
                "type": "number"
              },
              "evidence": {
                "type": "number"
              },
              "net_annual": {
                "type": "number"
              },
              "npv": {
                "type": "number"
              },
              "payback": {
                "type": "number"
              },
              "readiness": {
                "type": "number"
              }
            },
            "required": [
              "cash_share",
              "evidence",
              "net_annual",
              "npv",
              "payback",
              "readiness"
            ]
          },
          "eligible": {
            "type": "boolean"
          },
          "id": {
            "type": "string"
          },
          "outcome": {
            "type": "string"
          },
          "rank": {
            "type": "number"
          },
          "score": {
            "type": "number"
          }
        },
        "required": [
          "contributions",
          "criteria",
          "eligible",
          "id",
          "outcome",
          "rank",
          "score"
        ]
      }
    },
    "why_a_over_b": {
      "type": "array",
      "items": {
        "type": "object",
        "properties": {
          "over": {
            "type": "string"
          },
          "reasons": {
            "type": "array",
            "items": {
              "type": "string"
            }
          },
          "score_gap": {
            "type": "number"
          },
          "under": {
            "type": "string"
          }
        },
        "required": [
          "over",
          "reasons",
          "score_gap",
          "under"
        ]
      }
    },
    "weights": {
      "type": "object",
      "properties": {
        "net_annual": {
          "type": "number"
        },
        "npv": {
          "type": "number"
        },
        "payback": {
          "type": "number"
        },
        "evidence": {
          "type": "number"
        },
        "readiness": {
          "type": "number"
        },
        "cash_share": {
          "type": "number"
        }
      },
      "required": [
        "cash_share",
        "evidence",
        "net_annual",
        "npv",
        "payback",
        "readiness"
      ]
    },
    "decisions": {
      "type": "object",
      "additionalProperties": {
        "type": "object",
        "properties": {
          "data_readiness": {
            "type": "object",
            "properties": {
              "checks": {
                "type": "array",
                "items": {
                  "type": "object",
                  "properties": {
                    "check": {
                      "type": "string"
                    },
                    "ok": {
                      "type": "boolean"
                    }
                  },
                  "required": [
                    "check",
                    "ok"
                  ]
                }
              },
              "level": {
                "type": "string"
              },
              "missing": {
                "type": "array",
                "items": {
                  "type": "string"
                }
              },
              "share": {
                "type": "number"
              }
            },
            "required": [
              "checks",
              "level",
              "missing",
              "share"
            ]
          },
          "economics": {
            "type": "object",
            "properties": {
              "baseline_cost_inr": {
                "type": [
                  "null",
                  "number"
                ]
              },
              "baseline_note": {
                "type": [
                  "null",
                  "string"
                ]
              },
              "budget": {
                "type": "object",
                "properties": {
                  "contingency_pct": {
                    "type": "number"
                  },
                  "lines": {
                    "type": "array",
                    "items": {
                      "type": "object",
                      "properties": {
                        "budget_inr": {
                          "type": [
                            "null",
                            "number"
                          ]
                        },
                        "line": {
                          "type": "string"
                        },
                        "need_inr": {
                          "type": "number"
                        },
                        "note": {
                          "type": "string"
                        },
                        "status": {
                          "type": "string"
                        }
                      },
                      "required": [
                        "budget_inr",
                        "line",
                        "need_inr",
                        "note",
                        "status"
                      ]
                    }
                  },
                  "status": {
                    "type": "string"
                  },
                  "total_with_contingency_inr": {
                    "type": "number"
                  }
                },
                "required": [
                  "contingency_pct",
                  "lines",
                  "status",
                  "total_with_contingency_inr"
                ]
              },
              "capacity_value_inr": {
                "type": "number"
              },
              "cashable_savings_inr": {
                "type": "number"
              },
              "cashable_share_pct": {
                "type": "number"
              },
              "cashable_share_source": {
                "type": "string"
              },
              "competitiveness": {
                "type": "object",
                "properties": {
                  "annualised_ai_cost_inr": {
                    "type": "number"
                  },
                  "basis": {
                    "type": "string"
                  },
                  "class": {
                    "type": "string"
                  },
                  "ratio": {
                    "type": "number"
                  }
                },
                "required": [
                  "annualised_ai_cost_inr",
                  "basis",
                  "class",
                  "ratio"
                ]
              },
              "flags": {
                "type": "array",
                "items": {
                  "type": "object",
                  "properties": {
                    "code": {
                      "type": "string"
                    },
                    "message": {
                      "type": "string"
                    }
                  },
                  "required": [
                    "code",
                    "message"
                  ]
                }
              },
              "gross_cost_avoidance_inr": {
                "type": "number"
              },
              "gross_note": {
                "type": "string"
              },
              "net_cashable_inr": {
                "type": "number"
              },
              "retained_human_cost_inr": {
                "type": [
                  "null",
                  "number"
                ]
              }
            },
            "required": [
              "baseline_cost_inr",
              "baseline_note",
              "budget",
              "capacity_value_inr",
              "cashable_savings_inr",
              "cashable_share_pct",
              "cashable_share_source",
              "competitiveness",
              "flags",
              "gross_cost_avoidance_inr",
              "gross_note",
              "net_cashable_inr",
              "retained_human_cost_inr"
            ]
          },
          "eligibility": {
            "type": "object",
            "properties": {
              "eligible": {
                "type": "boolean"
              },
              "gates": {
                "type": "array",
                "items": {
                  "type": "object",
                  "properties": {
                    "detail": {
                      "type": "string"
                    },
                    "gate": {
                      "type": "string"
                    },
                    "status": {
                      "type": "string"
                    }
                  },
                  "required": [
                    "detail",
                    "gate",
                    "status"
                  ]
                }
              }
            },
            "required": [
              "eligible",
              "gates"
            ]
          },
          "evidence": {
            "type": "object",
            "properties": {
              "band": {
                "type": "string"
              },
              "band_capped_by_fixture": {
                "type": "boolean"
              },
              "observed_weight": {
                "type": "number"
              },
              "share": {
                "type": "number"
              },
              "total_weight": {
                "type": "number"
              }
            },
            "required": [
              "band",
              "band_capped_by_fixture",
              "observed_weight",
              "share",
              "total_weight"
            ]
          },
          "gaps": {
            "type": "array",
            "items": {
              "type": "object",
              "properties": {
                "impact": {
                  "type": "string"
                },
                "input": {
                  "type": "string"
                },
                "why": {
                  "type": "string"
                }
              },
              "required": [
                "impact",
                "input",
                "why"
              ]
            }
          },
          "next_actions": {
            "type": "array",
            "items": {
              "type": "object",
              "properties": {
                "action": {
                  "type": "string"
                },
                "code": {
                  "type": "string"
                },
                "expected_test": {
                  "type": "string"
                },
                "owner_hint": {
                  "type": "string"
                }
              },
              "required": [
                "action",
                "code",
                "expected_test",
                "owner_hint"
              ]
            }
          },
          "outcome": {
            "type": "string"
          },
          "reason_codes": {
            "type": "array",
            "items": {
              "type": "string"
            }
          },
          "reasons": {
            "type": "array",
            "items": {
              "type": "string"
            }
          },
          "what_would_reverse": {
            "type": "array",
            "items": {
              "type": "object",
              "properties": {
                "change_pct": {
                  "type": "number"
                },
                "field": {
                  "type": "string"
                },
                "from_value": {
                  "type": "number"
                },
                "new_outcome": {
                  "type": "string"
                },
                "statement": {
                  "type": "string"
                },
                "to_value": {
                  "type": "number"
                }
              },
              "required": [
                "change_pct",
                "field",
                "from_value",
                "new_outcome",
                "statement",
                "to_value"
              ]
            }
          }
        },
        "required": [
          "data_readiness",
          "economics",
          "eligibility",
          "evidence",
          "gaps",
          "next_actions",
          "outcome",
          "reason_codes",
          "reasons",
          "what_would_reverse"
        ]
      },
      "x-keyed-by": "proposal id"
    },
    "warnings": {
      "type": "array"
    }
  },
  "required": [
    "decisions",
    "overall",
    "ranking",
    "warnings",
    "weights",
    "why_a_over_b"
  ]
}
